{
  "$schema": "./inert_declarations_allowlist.v1.schema.json",
  "contract_version": 1,
  "contract": "inert_declarations_allowlist",
  "purpose": [
    "The declared-but-unread configuration defect class, recorded once, with a written reason for every entry.",
    "A configuration key that an operator can set, that ships in config.example.yaml, and that nothing reads is the defect this contract exists for. Setting it is not an error, the model accepts it, and the configured behaviour never appears. The originating incident was a model_pricing block documented as the cost fallback and read by nobody, so every cost in the product was null while the shipped template carried eight price entries and no test failed: the test that existed asserted that the config parses, and parsing is not reading.",
    "Entries here are not a to-do list of things somebody forgot. They are the current, reviewed state of the defect, and each states why the declaration is acceptable as it stands. Deleting a config key is a breaking change for every existing install and an operator decision (backend/packages/harness/alpha/config/AGENTS.md), so a gate never demands a key be removed to pass; it demands the inertness be recorded.",
    "An entry must be removed as soon as a reader exists, and the gate fails on a stale entry precisely so an allowlist cannot quietly become a permanent waiver."
  ],
  "rules": [
    "reason is required on every entry and must be a non-empty string; the schema and the gate both reject a whitespace-only reason.",
    "declaration_only_keys and unreachable_flags must equal the scan's finding sets exactly: an undocumented finding fails the gate, and so does a documented finding that no longer exists.",
    "operator_kwarg_models is derived from the models (extra=\"allow\") and cross-checked in both directions, so opening a model to operator kwargs fails until somebody says how they are consumed, and closing one fails the stale check.",
    "The root AppConfig is listed as an open model but exempts no declared field; see kwarg_bag_paths in backend/tests/test_no_inert_config.py.",
    "known_blind_spots is the inverse list: keys an audit believes are inert that the gate cannot prove, each with the reason it is out of reach. Gate B errs toward under-reporting, never toward a false build failure, so this section is what keeps that honest."
  ],
  "operator_kwarg_models": [
    {
      "target": "alpha.config.app_config.AppConfig",
      "reason": "extra=\"allow\" on purpose, and the gate deliberately exempts none of its declared fields. The root's openness is about keys no model declares (an operator may put one in config.yaml and the loader hands it to plugins and provider factories); it says nothing about the sections AppConfig does declare, and those are where an inert declaration lives. The undeclared tail has no field surface to gate; the declared sections are all gated by path."
    },
    {
      "target": "alpha.config.tool_config.ToolConfig",
      "reason": "extra=\"allow\" on purpose: every field past the registry identity is a provider keyword argument forwarded verbatim to the constructor of whichever class the operator names in `use:`. Who consumes a given kwarg is a property of that choice, not of this model, so no static reference can prove a reader and requiring one would require a fiction. The registry identity (name/group/use) is separately pinned by the feature-manifest wiring gate."
    },
    {
      "target": "alpha.config.tool_config.ToolGroupConfig",
      "reason": "Same operator-kwarg bag as ToolConfig: a group carries the tool names and per-tool kwargs the operator selected, resolved by the tool registry at agent-construction time."
    },
    {
      "target": "alpha.config.voice_config.VoiceConfig",
      "reason": "extra=\"allow\" on purpose: STT/TTS/wake-word settings are per-engine keyword arguments resolved by the voice chain at run time from the engine the operator selected, so a kwarg's reader is chosen dynamically."
    },
    {
      "target": "alpha.config.sandbox_config.SandboxConfig",
      "reason": "extra=\"allow\" on purpose: sandbox settings are passed to the provider selected by `sandbox.use`, whose class decides which kwargs it honours. The provider registry itself is separately pinned by the feature-manifest wiring gate; the kwarg bag is not statically checkable."
    },
    {
      "target": "alpha.config.agent_preset_config.AgentPresetConfig",
      "reason": "extra=\"allow\" on purpose: a preset carries operator-selected toolset kwargs resolved by the tool registry when the agent is built, so which key a preset passes on is decided by the named tool rather than by this model."
    },
    {
      "target": "alpha.config.extensions_config.ExtensionsConfig",
      "reason": "extra=\"allow\" on purpose: mcpServers and skill entries are third-party declarations (headers, oauth, env, task toolsets) consumed by the MCP client factory per server. A given key's reader is the third-party server, which is by definition outside this repository."
    },
    {
      "target": "alpha.config.model_config.ModelConfig",
      "reason": "extra=\"allow\" on purpose and documented in model_config.py: operators carry provider-specific connection kwargs (api_key, base_url, and whatever a given provider class accepts) that are forwarded verbatim to the chat client its `use:` names. Which key is honoured is a property of the provider class the operator selected, so no reference in this repository can prove a reader. The fields this repository does own (name, model, capabilities, the reasoning-effort ladder) are separately pinned: the ladder by alpha/config/reasoning_effort.py, the slug by tests/test_model_config.py."
    },
    {
      "target": "alpha.config.model_config.ProviderConfig",
      "reason": "Same mechanism as ModelConfig: a named provider profile holds the connection kwargs inherited by every models[] entry that references it, forwarded to that provider's client. Which models may name the profile is checked at load by AppConfig._validate_model_routing."
    }
  ],
  "declaration_only_keys": [
    {
      "target": "context_window.next_turn_reserve_tokens",
      "reason": "Read, but not visible to the name channel: ContextWindowConfig.window_spec() -- defined in the declaring module -- forwards this reserve into alpha.runtime.context_window.resolve_context_window, and window_spec() is called by live modules (app/gateway/context_usage.py, app/gateway/routers/ops.py) to derive the usable input window. The field name appears in no expression outside alpha.config.context_window_config, which is the only reason the scan reports it: callers read the derived ContextWindowSpec, not the config field. Not the memory.fabric case: the configured value reaches production."
    },
    {
      "target": "context_window.output_reserve_tokens",
      "reason": "Same accessor-invisibility as context_window.next_turn_reserve_tokens: the declaring module's window_spec() forwards this reserve into alpha.runtime.context_window.resolve_context_window, and the live callers (app/gateway/context_usage.py, app/gateway/routers/ops.py) consume the derived spec, so the field name is absent from every read expression outside its declaring module while the configured value does reach production."
    },
    {
      "target": "gro.relative_rank_is_tiebreaker_only",
      "reason": "Documentation-only by design: alpha.gro selects on absolute score after hard gates and carries relative rank as a diagnostic only (its winner reason says 'relative rank ... is diagnostic only'), so the invariant holds structurally and gro/AGENTS.md records the field as pinned true by design. Flipping it changes no behaviour, which is the declared-but-unread shape this gate records; deleting a config key is a breaking change for existing installs and an operator decision (config/AGENTS.md)."
    },
    {
      "target": "intelligence.difficulty_thresholds",
      "reason": "Declared by alpha.intelligence.config and named nowhere else in production, so no code path branches on it: alpha.intelligence.difficulty resolves bands from the module constant DEFAULT_BANDS and DifficultyEstimator takes bands as an explicit constructor parameter, neither of which reads this dict. The value is echoed on the read surface (GET /api/intelligence/snapshot projects the whole section as data), but a projection is not a behaviour: setting the key changes nothing. Recorded rather than deleted because deleting a config key is a breaking change for existing installs and an operator decision (config/AGENTS.md)."
    },
    {
      "target": "intelligence.experts.dynamic_growth",
      "reason": "Declared by alpha.intelligence.config and named nowhere else in production: the fabric's dynamic-growth path (ExpertFabric.propose / mark_trial_ready) takes explicit arguments and consults no config for this decision, so setting the flag changes nothing today. The layer's accessor intelligence_config() is live for other fields (e.g. experts.grace_period_seconds), so only the flag is unread. Recorded rather than deleted (config/AGENTS.md)."
    },
    {
      "target": "intelligence.experts.dynamic_pruning",
      "reason": "Declared by alpha.intelligence.config and named nowhere else in production: ExpertFabric.evaluate_prune / mark_prune_candidate take their decision inputs as explicit arguments and refuse a protected expert from the record, never from this flag, so setting it changes nothing today. Recorded rather than deleted (config/AGENTS.md)."
    },
    {
      "target": "intelligence.experts.trial_min_success_rate",